pdf_name,title,author,author_place,journal,volume,year,pages
"Loon, M. van - The Place of Urartu in First-Millennium B.C. Trade 32.pdf",The Place of Urartu in First-Millennium B.C. Trade,Maurits van Loon,,Iraq,39,1977,229-231
Lyczkowska_2005_RO57_rev_OAB.pdf,La vie quotidienne et commerciale des Assyriens de la période dite paléoassyrienne,Cecile Miehe,Leiden,"Old Assyrian Archives, Studies",1,2003,X+203 pp.
Magness_05_ossuaries.pdf,OSSUARIES AND THE BURIALS OF JESUS AND JAMES,Jodi Magness,"Chapel Hill, NC",Journal of Biblical Literature,124,2005,121–154
"Manning, et al_2016_Integrated Tree-ring-radiocarbon high-resolution timeframe to resolve earlier 2ndMillBCE Mesopotamian Chronology_PLoS1, 11(7).PDF",Integrated Tree-Ring-Radiocarbon High-Resolution Timeframe to Resolve Earlier Second Millennium BCE Mesopotamian Chronology,"Sturt W. Manning, Carol B. Griggs, Brita Lorentzen, Gojko Barjamovic, Christopher Bronk Ramsey, Bernd Kromer, Eva Maria Wild","Ithaca, New York",PLoS ONE,11,2016,e0157144
Manning_etal_2001_Science294_Anatolian_Tree-Rings.pdf,Anatolian Tree Rings and a New Chronology for the East,"S. W. Manning, B. Kromer, P. I. Kuniholm, M. W. Newton",,Science,294,2001,2532
Manning_etal_2006_Science312_Chronology_Aegean_LBA.pdf,Chronology for the Aegean Late Bronze Age 1700–1400 B.C.,"Sturt W. Manning, Christopher Bronk Ramsey, Walter Kutschera, Thomas Higham, Bernd Kromer, Peter Steier, Eva M. Wild",,Radiocarbon,,2006,
"Marzahn, J & Salje, B. eds. - Wiedererstehendes Assur. 100 Jahre deutsche Ausgrabungen in Assyrien. 2003.pdf",Wiedererstehendes ASSUR,Joachim Marzahn • Beate Salje,Mainz am Rhein,,,2003,204 Seiten mit 106 Farb- und 84 Schwarzweißabbildungen
"Matouš, L. (ed.) - Inscriptions cunéiformes du Kultépé. II (Review). OLZ 60, 1965 155.pdf",Inscriptions cunéiformes du Kultépé. II (Book Review),L. Matou,,Orientalistische Literaturzeitung,60,1965,146
Maxwell-Hyslop - Sources of Sumerian Gold 14.pdf,"Sources of Sumerian Gold: The Ur Goldwork from the Brotherton Library, University of Leeds. A Preliminary Report",K. R. Maxwell-Hyslop,Leeds,Iraq,39,1977,83-86
Mayali_1995_legtrad.pdf,"FOREWORD: SOCIAL PRACTICES, LEGAL NARRATIVE, AND THE DEVELOPMENT OF THE LEGAL TRADITION",LAURENT MAYALI,,,Chi.-Kent L. Rev.,1995,1994-1995
McCreedy_2002_JNES63_Rev_Schloen_PHM.pdf,The House of the Father as Fact and Symbol: Patrimonialism in Ugarit and the Ancient Near East,J. David Schloen,"Winona Lake, Indiana",Studies in the Archaeology and History of the Levant,2,2001,xv + 414 + 25 figs. + 5 photographs + 17 tables
McGeough_2005_Exchange_Relationships_diss.pdf,EXCHANGE RELATIONSHIPS AT UGARIT: A STUDY OF THE UGARITIC ECONOMIC TEXTS,Kevin M. McGeough,,,,2005,
Melchert_LUVLEX.pdf,CUNEIFORM LUVIAN LEXICON,H. Craig Melchert,"Chapel Hill, N.C.",LEXICA ANATOLICA,2,1993,
Melchert_letoon.pdf,The Trilingual Inscription of the Létôon,Graig Melchert,,,,2000,
Michalowski_2005_ZA95_Iddin-Dagan_Family.pdf,Iddin-Dagan and his Family,Piotr Michalowski,Ann Arbor,Zeitschrift für Assyriologie,95,2005,65–76
Michalowski_2009_LyczkowskaFS_Assur During the UrIII Period pp. 149-156.pdf,Ańńur during the Ur III Period,Piotr Michałowski,"University of Michigan, Ann Arbor",,,2009,149
Michel 2021_Syria-review Gemane1.pdf,Studying Gender in the Ancient Near East,Saana SVÄRD et Agnès GARCIA-VENTURA,,Syria,,2021,
"Michel C.- Old Assyrian Bibliography (OAAS 1 -PIHANS 97, 2003) (OCR).pdf","Old Assyrian Bibliography (Old Assyrian Archives, Studies, volume 1)",Cécile Michel,Leiden,,1,2003,
"Michel, C. et Rocher, P. - La Chronologie du IIe Millenaire. Revue a l'Ombre d'Une Eclipse de Soleil. JEOL 35-36, 1997-00 111-126.pdf",LA CHRONOLOGIE DU IIe MILLÉNAIRE,"Cécile Michel, Patrick Rocher",,,,1997,
"Michel, Cecile - Hommes et femmes prêtent serment à l'époque paléo-assyrienne. Méditerranées 10-11, 1997 105-123.pdf",Les serments paléo-assyriens,Cécile Michel,,,,1997,
"Michel, Cecile - Les Mites d'Assyrie Moths in the Assyrian Texts of the Second Millennium BC. JAOS 118, 1998, pp. 325-331.pdf",Les Mites d'Assyrie Moths in the Assyrian Texts of the Second Millennium B. C.,Cécile Michel,Paris,Journal of the American Oriental Society,118,1998,325–331
"Michel, Cecile - Old Assyrian Bibliography, OAAS 1. PIHANS 97, 2003 (2).pdf","Old Assyrian Bibliography (Old Assyrian Archives, Studies, volume 1)",Cécile Michel,Leiden,,1,2003,
"Michel, Cecile - Old Assyrian Bibliography, OAAS 1. PIHANS 97, 2003.pdf","Old Assyrian Bibliography (Old Assyrian Archives, Studies, volume 1)",Cécile Michel,Leiden,Nederlands Instituut voor het Nabije Oosten,1,2003,
"Michel, Cecile - Tablettes Paleo-Assyriennes de Kültepe, Vol. 1 (Kt  90-k). 1997.pdf",TABLETTES PALEO-ASSYRIENNES DE KULTEPE,Cecile MICHEL et Paul GARELLI,Istanbul,,1,1997,
"Michel, Cecile - The Alāhum and Aššur-taklāku Archives Found in 1993 at Kültepe Kaniš. AoF 35 1, 2008, pp. 53-67.pdf",The Ala¯hum and Asˇsˇur-takla¯ku archives found in 1993 at Kültepe Kanisˇ,Cécile Michel,,Altoriental. Forsch.,35,2008,53–67
"Michel, Cecile ed. - Old Assyrian Studies in Memory of Paul Garelli. PIHANS 112, 2008 (2).pdf",Old Assyrian Studies in Memory of Paul Garelli,Cécile Michel,Leiden,Nederlands Instituut voor het Nabije Oosten,,2008,
"Michel, Cecile ed. - Old Assyrian Studies in Memory of Paul Garelli. PIHANS 112, 2008.pdf",Old Assyrian Studies in Memory of Paul Garelli,Cécile Michel,Leiden,Nederlands Instituut voor het Nabije Oosten,2008,2008,
"Michel, Cécile - Correspondance des marchands de Kanish. LAPO 19, 2001.pdf",Correspondance des marchands de Kaniš au début du IIe millénaire avant J.—C.,Cécile Michel,Paris,,,2001,
Michel-ANE-Today-June-2021.pdf,"Housewives, Weavers and Businesswomen: Assyrian Women from Assur and Kanesh",Cécile Michel,,,,2021,
"Michel_1997c_Méditerranées10_Hommes et femmes prêtent serment à l'époque paléo-assyrienne. Méditerranées 10-11, 1997 105-123.pdf",Les serments paléo-assyriens,Cécile Michel,,,,1997,
Michel_2003b_PECUS_perdum-mule.pdf,"The perdum-mule, a mount for distinguished persons in Mesopotamia during the first half of the second millennium BC",Cécile Michel,,PECUS. Man and animal in antiquity,,2004,
"Michel_2005_AfO51_Old Assyrian Bibliography 1. AfO 51, 2005-06, pp. 436-449.pdf",Old Assyrian Bibliography 1,Cécile Michel,Orsay,Archiv für Orientforschung,51,2005/2006,437
Michel_2008_Eothen16-New Perspective on Historical Geo.pdf,NEW PERSPECTIVES ON THE HISTORICAL GEOGRAPHY AND TOPOGRAPHY OF ANATOLIA IN THE II AND I MILLENIUM B.C.,Cécile Michel,,,3,2008,235–236
Michel_2008_La Correspondes.pdf,La lettre d’archive,Cécile Michel,,Institut français d’archéologie orientale,9,2008,118
Michel_2008_Les Assyr. et les Esprits de Leurs Morts.pdf,Old Assyrian Studies in Memory of Paul Garelli,Cécile Michel,Nanterre,OAAS,4,2008,181-197
Michel_2008_OAAS3.pdf,Anatolia and the Jazira during the Old Assyrian period,Cécile Michel,Nanterre,PIHANS,111,2008,209-229
Michel_2008_OAAS4_Intro.pdf,Old Assyrian Studies in Memory of Paul Garelli,Cécile Michel,Leiden,Nederlands Instituut voor het Nabije Oosten,4,2008,249
Michel_2008_PIHANS111.pdf,Anatolia and the Jazira during the Old Assyrian period,Cécile Michel,Nanterre,PIHANS,111,2008,209-229
"Michel_2008_RANT5_Des Paragrinations des Marchands Assyriennes. RANT 5, 2008 371-388.pdf",Les pérégrinations des marchands assyriens en haute Mésopotamie et en Asie Mineure,Cécile Michel,Nanterre,Res Antiquae,5,2008,371-388
Michel_2008_TopoiSup9.pdf,La lettre d’archive,Cécile Michel,,Institut français d’archéologie orientale,9,2008,32
Michel_2009_Bottero.pdf,Boissons et buveurs en haute Mésopotamie et Anatolie au début du IIe millénaire av. J.-C.,Cécile Michel,Paris,Travaux de la Maison René-Ginouvès,6,2009,197-220
Michel_2009_CSMS.pdf,The Old Assyrian Trade in the light of Recent Kültepe Archives,Cécile Michel,Nanterre,,,2009,71
Michel_2009_TopoiSup10a.pdf,"Femmes, cultures et sociétés dans les civilisations méditerranéennes et proche-orientales de l’Antiquité","Françoise Briquel-Chatonnet, Saba Farès, Brigitte Lion, Cécile Michel",,Topoi,10,2009,4-Mar
Michel_2009_TopoiSup10b.pdf,LES FILLES CONSACRÉES DES MARCHANDS ASSYRIENS,Cécile Michel,,Topoi,10,2009,145-163
Michel_2009_TopoiSup10c.pdf,LES FEMMES ET L’éCRIT DANS LES ARCHIVES PALéO-ASSYRIENNES,Cécile Michel,,Topoi,10,2009,253-272
Michel_2010_C9T3_Textiles.pdf,Le vocabulaire des étoffes dans les textes cunéiformes : le cas des archives paléo-assyriennes (XIXe-XVIIIe s. av. J.-C.),Cécile Michel,Nanterre,Cahier des thèmes transversaux ArScAn,IX,2010,23-29
Michel_2010_C9T9_Boissons.pdf,Les boissons en Mésopotamie du nord et Anatolie dans la première moitié du IIe millénaire av. J.-C.,Cécile Michel,Nanterre,Cahier des thèmes transversaux ArScAn,IX,2010,351-358
Michel_2010_C9T9_SHAMO_Intro.pdf,Thème IX - L’alimentation dans l’orient ancien. De la production à la consommation,Cécile Michel,Nanterre,Cahier des thèmes transversaux ArScAn,IX,2010,231-233
Michel_2010_C9T9_Transport.pdf,Le transport des denrées alimentaires dans la documentation écrite du début du IIe millénaire,Cécile Michel,Nanterre,Cahier des thèmes transversaux ArScAn,IX,2010,265-275
Michel_2010_Epoc.pdf,Die Ehe galt den Assyrern als heilige Angelegenheit,Reyhan Eksi,,epoc,,2010,
Michel_2010_JA298_CRMelBordreuil.pdf,COMPTES RENDUS,,Paris,Journal Asiatique,27,2010,357 p.
Michel_2010_JCS62.pdf,Deux textes ATYPIQUES découverts à Kültepe,Cécile Michel,Nanterre,JCS,62,2010,71–72
Michel_2010_MathReviews.pdf,Tablettes math´ematiques de la collection Hilprecht,Cécile Michel,Wiesbaden,Texte und Materialien der Hilprecht Collection,8,2010,x+166 pp.
Michel_2010_MelDonbaz.pdf,THE DAY UNIT WITHIN THE OLD ASSYRIAN CALENDAR,Cécile Michel,Istanbul,Veysel Donbaz’a Sunulan Yazılar DUB.SAR É.DUB.BA.A Studies Presented in Honour of Veysel Donbaz,,2010,
Michel_2010_RAI53V1_12.pdf,Le langage ﬁguré dans les lettres paléo-assyriennes,Cécile Michel,Nanterre,,,2010,
Michel_2011_CollMRG7.pdf,d’étude les tablettes d’argile remplies de signes en «forme de clous» (cunéiformes). Une liste paléographique de signes cunéiformes,Cécile Michel,,,,2011,245-257
Michel_2015_KIM1_Subartu35.pdf,Proceedings of the 1st Kültepe International Meeting,Fikri Kulakoğlu & Cécile Michel,Kültepe,Subartu,XXXV,2013,1-249
Michel_2015_NouvellesArchéologie.pdf,Quelle place occupent les femmes dans les sources cunéiformes de la pratique ?,Cécile Michel,,Les Nouvelles de l’archéologie,140,2015,3–61
Michel_2018_Syria-7771.pdf,"Philippe Quenet (dir.), Ana ziqquratim. Sur la piste de Babel",Cécile Michel,Strasbourg,Syria,2018,2018,
Michel_2020_WSAWM5_Maths&Admin_Intro_Chap2_Chap10s.pdf,Why the Sciences of the Ancient World Matter,"Cécile Michel, Karine Chemla","Paris, France","Mathematics, Administrative and Economic Activities in Ancient Worlds",5,2020,1-123
Michel_2021_Subartu47_Diyala.pdf,Interdisciplinary research on the Bronze Age Diyala,Carlos Gonçalves & Cécile Michel,,Subartu,47,2021,1–103
Michel_2021_À table avec les anciens Mésopotamiens_AEA hypothèses.pdf,À table avec les anciens Mésopotamiens,Cécile Michel,,,,2021,
Michel_2022_EcritureSansDomination.pdf,L’écriture confère-t-elle une forme de domination ? Les Assyriens en Anatolie au XIXe siècle avant J.-C.,Cécile Michel,,,,2022,
Michel_2022_WSAWM6.pdf,Why the Sciences of the Ancient World Matter,"Karine Chemla, Agathe Keller, Christine Proust","Paris, France",Cultures of Computation and Quantification in the Ancient World,6,2022,
Michel_2023_Gendered Private Letters.pdf,Gendered Private Letters: The Case of the Old Assyrian Correspondence (Nineteenth Century BC),Cécile Michel,,La correspondance privée dans la Méditerranée antique,,2025,223-241
Michel_Kulakoglu_2021_KIM4_SUBARTU46.pdf,Cultural Exchanges and Current Research at Kültepe and its Surroundings,"Fikri Kulakoğlu, Guido Kryszat, Cécile Michel",,Subartu,46,2021,1–275
Michel_Nosch_2010_TextileTerminologies.pdf,Textile Terminologies in the ancient Near East and Mediterranean from the Third to the First Millennia BC,C. Michel and M.-L. Nosch,,,8,2013,
Michel_Veenhof_2010_OATextiles.pdf,Textile Terminologies in the ancient Near East and Mediterranean from the Third to the First Millennia BC,C. Michel and M.-L. Nosch,,,8,2013,
Moqaddam_2009.PDF,"Ancient geometry and ""*Proto-Iranian"" scripts",Azhideh Moqaddam,,,,2009,
"Mueller, Manfred & Marzhan, Joahim - Fünf Altassyrische Texte aus dem Vorderasiatischen Museum zu Berlin, FS Oelsner. AOAT 252, 2000, pp. 285-309.pdf",Assyriologica et semitica: Festschrift für Joachim Oelsner anläßlich seines 65. Geburtstages am 18. Februar 1997,Joachim Marzahn und Hans Neumann,Münster,Alter Orient und Altes Testament,252,2000,1–623
"Muhly, J. D. - The Copper Ox-Hide Ingots and the Bronze Age Metals Trade 13.pdf",The Copper Ox-Hide Ingots and the Bronze Age Metals Trade,J. D. Muhly,,Iraq,39,1977,73-82
Myrhman BE 3 1.pdf,Sumerian Administrative Documents Dated in the Reigns of the Kings of the Second Dynasty of Ur,David W. Myhrman,Philadelphia,Cuneiform Texts,1,1910,1–100
NABU 1987.1 - 4014.4.pdf,Ylssyrio{ogiques rßdves et VtiCitaires,Dominique CHARPIN,Paris,N.A.B. U.,1,1987,
"Nashef, Khaled - Rekonstruktion der Reiserouten zur Zeit der altassyrischen Handelsniederlassungen. TAVO Beih. B 83, 1987(cut).pdf",Rekonstruktion der Reiserouten zur Zeit der altassyrischen Handelsniederlassungen,Khaled Nashef,Tübingen,Beihefte zum Tübinger Atlas des Vorderen Orients,B,1987,
Nasrabadi_04_Anubanini.pdf,Beobachtungen zum Felsrelief Anubaninis,Behzad Mofidi Nasrabadi,Mainz,Zeitschrift für Assyriologie,94,2004,291–303
Newman_Paasi_1998.pdf,Fences and neighbours in the postmodern world: boundary narratives in political geography,David Newman and Anssi Paasi,"Beer Sheva, Israel and Oulu, Finland",Progress in Human Geography,22,1998,186–207
"OAAS 1 - OA Bib, 2003.pdf",Old Assyrian Bibliography,Cécile Michel,Leiden,"Old Assyrian Archives, Studies",1,2003,
OAAS 1 Excerpt of OA Bibliography.pdf,"K. R. Veenhof, Aspects of the Old Assyrian Trade and its Terminology",Cécile MICHEL,,,10,1972,
"OAI, 2004.pdf",Old Assyrian Institutions,J.G. Dercksen,Leiden,Nederlands Instituut voor het Nabije Oosten,4,2004,
"Oates, D. - The Excavations at Tell Brak, 1976 33.pdf","The Excavations at Tell Brak, 1976",David Oates,,Iraq,39,1977,233-244
Oppenheim_1967_JESHO10_Structure_Mes_soc.pdf,MESOPOTAMIAN SOCIETY,A. L. OPPENHEIM,,,,2001,
"Otten, H. & V. Souček - Das Gelübde der Königin Puduḫepa an die Göttin Lelwani. StBoT 1, 1965.pdf",DAS GELÜBDE DER KÜNIGIN PUDU]J:EPA AN DIE GÖTTIN LELWANI,"Heinrich Otten, Vladimir Soucek",Mainz,Studien zu den Bogazköy-Texten,1,1965,
"Oz, E. & I. Albayrak - 1963 Yılı Kültepe Kazısında Ele Geçen Altı Yeni Tablet. ArAn 8.2, 2005 21-45.pdf",1963 Yılı Kültepe Kazısında Ele Geçen Altı Yeni Tablet,"Esma Öz, İrfan Albayrak",,ARCHIVUM ANATOLICUM,2-Aug,2005,21-45
"Ozguc, Nimet - The Anatolian Group of Cylinder Seal Impressions from Kultepe. TTKY V 22, 1965.pdf",THE ANATOLIAN GROUP OF CYLINDER SEAL IMPRESSIONS FROM KULTEPE,Nimet Ozgii,Ankara,TURK TARiH KURUMU YAYINLARINDAN,"V. SERi, No. 22",1965,
PIHANS_74.pdf,Ancient Near Eastern Studies Presented to Philo H.J. Houwink ten Cate on the Occasion of his 65th Birthday,Theo P.J. van den Hout and Johan de Roos,Leiden,Studio Historiae Ardens,LXXIV,1995,1–105
PRU 3 text.pdf,Le Palais d'Ugarit,Cl. A. Schaeffer,,,,1955,
Palmisano_2018_high_quality.pdf,The Geography of Trade,Alessio Palmisano,Oxford,Archaeopress Archaeology,,2018,
Palmisano_PhD_2015.pdf,Spatial Approaches to the Political and Commercial Landscape of the Old Assyrian Colony Period,Alessio Palmisano,London,,,2015,
Papazian_Eg_econ_diss_2005.pdf,Domain of Pharaoh: The Structure and Components of the Economy of Old Kingdom Egypt,Hratch Papazian,"Chicago, Illinois",,,2005,
Pardee Rev of Tropper.pdf,Ugaritische Grammatik,Josef Tropper,Münster,Archiv für Orientforschung,50,2003/2004,
"Parker, Barbara - Middle Assyrian Seal Impressions from Tell al Rimah 35.pdf",Middle Assyrian Seal Impressions from Tell al Rimah,Barbara Parker,,Iraq,39,1977,257-268
Parpola_assyrianidentity.pdf,ASSYRIAN IDENTITY IN ANCIENT TIMES AND TODAY,Simo Parpola,Helsinki,,,2004,
Paulus_1995_CKLR79_romfamlaw.pdf,CHANGES IN THE POWER STRUCTURE WITHIN THE FAMILY IN THE LATE ROMAN REPUBLIC,CHRISTOPH G. PAULUS,,Chi.-Kent L. Rev.,70,1994-1995,
Petrie Arthribis.pdf,"British School of Archaeology in Egypt, and Egyptian Research Account",W. M. Flinders Petrie,London,British School of Archaeology in Egypt,14,1908,1–15
Poebel BE 6 2.pdf,"Sechsundzwanzig Altbabylonische Rechtsurkunden aus der Zeit Hammurabis uncl Ammixadugas in Umschrift, Uebersetzung und Kommentar, mit 8 Kopien",Arno Poebel,Eisenach,The Babylonian Expedition of the University of Pennsylvania,,1909,
"Postgate, J. N. - Excavations at Abu Salabikh, 1976 36.pdf","Excavations at Abu Salabikh, 1976",J. N. Postgate,,Iraq,39,1977,269-299
"Postgate, J. Nicholas - Bronze_Age_Bureaucracy.2013.pdf",Bronze Age bureaucracy: writing and the practice of government in Assyria,Nicholas Postgate,Cambridge,Cambridge University Press,,2013,
"Postgate, Nicholas - The Land of Assur & the Yoke of Assur (2008).pdf",The Land OF Assur & THE Yoke OF Assur,Nicholas Postgate,Oxford,,,2007,
"Powell, M. A. - Sumerian Merchants and the Problem of Profit 06.pdf",Sumerian Merchants and the Problem of Profit,Marvin A. Powell,,Iraq,39,1977,23-29
Pruzsinszky_2003_SCCNH13_Personnennamen_Texte_aus_Emar.pdf,DIE PERSONENNAMEN DER TEXTE AUS EMAR,Pruzsinszky,,,,2003,
Pulleyblank_1958_JESHO1_rev_Wittfogel_OrDespot.pdf,Oriental Despotism (Book Review),"PULLEYBLANK, E. G., Karl A. Wittfogel",,Journal of the Economic and Social History of the Orient,1,1958,348
RGTC 12-2 Emar.pdf,Die Orts- und Gewässernamen der Texte aus Emar (nach RGTC 12.2),Juan-Antonio Belmonte Marín,Universidad de Castilla-La Mancha,,,2007,
RGTC-10 Fincke (1993).pdf,Repertoire Geographique des Textes Cuneiformes,Wolfgang Röllig,Tübingen,Beihefte zum Tübinger Atlas des Vorderen Orients,10,1993,1–440
RGTC-12_2 Belmonte.pdf,Repertoire Geographique des Textes Cuneiformes XII/2 Die Orts- und Gewassernamen der Texte aus Syrien im 2. Jt. v. Chr.,Juan Antonio Belmonte Marin,Wiesbaden,Beihefte zum Tubinger Atlas des Vorderen Orients,2-Dec,2001,365–411
Radau BE 17 1.pdf,LETTERS TO CASSITE KINGS,Hugo Radau,PHILADELPHIA,THE BABYLONIAN EXPEDITION OF THE UNIVERSITY OF PENNSYLVANIA,XVII,1908,41
Radau BE 29 1.pdf,Miscellaneous Sumerian Texts from the Temple Library of Nippur,Hugo Radau,,,,1911,374–457
Radau BE 30 1.pdf,Sumerian Hymns and Prayers to God Dumu-21 or Babylonian Lenten Songs,Hugo Radau,München,,XXX,1913,
"Ragavan, Deena - Cuneiform Texts and Fragments in the Harvard Art Museum. cdlj 2010.1 1-17.pdf",Cuneiform Texts and Fragments in the Harvard Art Museum / Arthur M. Sackler Museum,Deena Ragavan,Harvard University,Cuneiform Digital Library Journal,1,2010,1–17
"Rahul Oka, R. & C. M. Kusimba - The Archaeology of Trading Systems, Part 1- Towards a New Trade Synthesis. JAR 2008 16, 339-395.pdf","The Archaeology of Trading Systems, Part 1: Towards a New Trade Synthesis",Rahul Oka Æ Chapurukha M. Kusimba,Chicago,J Archaeol Res,16,2008,339–395
Ranke BE 6 1.pdf,Die altbabylonischen Verträge aus Warka,I. N. Strassmaier,Berlin,Verhandlungen des 5. internationalen Orientalisten-kongresses,,1882,315-364 and pl. 1-144
"Reade, J.E. - A Monument of Erisum I from Assur. RA 94, 2001 177-177.pdf",A MONUMENT OF ERIŠUM I FROM AŠŠUR,J. E. READE,,Revue d’assyriologie et d’archéologie orientale,95,2001,177–178
Reimer_2001_Science294_Radiocarbon_twist.pdf,Radiocarbon dating and its calibration,"D. S. Reich, F. Mechler, J. D. Victor",,Science,294,2001,2566
"Reiner, Erica - Who Is Afraid of Old Assyrian. PIHANS 89, 2001 389-394.pdf",WHO IS AFRAID OF OLD ASSYRIAN?,Erica Reiner,Chicago,VEENHOF ANNIVERSARY VOLUME,,2001,390
"Renger, Johannes ed - Assur -- Gott, Stadt und Land. CDOG 5, 2011.pdf","Assur — Gott, Stadt und Land",Johannes Renger,Wiesbaden,Colloquien der Deutschen Orient-Gesellschaft,5,2011,1-441
Review of OA Copper Trade.pdf,Der Old Assyrian Copper Trade in Anatolia,Jan Gerrit Dercksen,Istanbul,Nederlands Historisch-Archaeologisch Instituut te Istanbul,,1996,279 pp.
Review of State and Economy in Egypt.pdf,State and Economy in Ancient Egypt: Fiscal Vocabulary of the New Kingdom,David A. Warburton,Fribourg,Orbis Biblicus et Orientalis,151,1997,379 pp.
Rosen_1977_Studies in Old Assyrian Loan Contracts.pdf,STUDIES IN OLD ASSYRIAN LOAN CONTRACTS,Bruce L. Rosen,,,,1977,
"Rouault, O. - L'Approvisionnement et la circulation de la laine a Mari 22.pdf",L'Approvisionnement et la circulation de la laine a Mari. D'Après une nouvelle lettre du roi à Mukannišum,O. Rouault,,Iraq,39,1977,147-153
Sanders_2006_OIS2_Margins_Writing.pdf,"Margins of Writing, Origins of Cultures",Seth L. Sanders,Chicago,Oriental Institute Seminars,2,2006,
Sandowicz_2005_RO57_rev_vanDriel_Elusive_Silver.pdf,Elusive silva,G. van Drie,,Uitgaven van het Nederlands Instituut voor het Nabije Oosten te Leiden,XCv,2002,345 pp.
Saskova_K_ed_Climb_the_Wall_of_Uruk_Essa.pdf,Essays in Honor of Petr Charvát,Kateřina Šašková,Plzeň,,,2020,
"Sauren, H. - Der handel zur zeit gudea's von lagasch, idealbild oder realität 12.pdf","Der handel zur zeit gudea's von lagasch, idealbild oder realität",H. Sauren,,Iraq,39,1977,71-72
Sazonov_Vladimir_2012_Einige_Bemerkungen.pdf,Einige Bemerkungen zur altassyrischen Königstitulatur,Vladimir Sazonov,Tartu,,,2012,
Schorr_Urkunden_Altbabylonischen_Zivil_und_Prozessrechts.pdf,Altbabylonische Rechtsurkunden,Schorr,,Vorderasiatische Bibliothek,,1913,327 Urkunden
Schramm - Akkadische Logogramme.pdf,Akkadische Logogramme,Wolfgang Schramm,Göttingen,Göttinger Arbeitshefte zur Altorientalischen Literatur,4,2003,1–180
"Shi, Xiaowen_2015_KIM1_Subartu35.pdf",Proceedings of the 1st Kültepe International Meeting,Fikri Kulakoğlu & Cécile Michel,Kültepe,Subartu,XXXV,2013,1-249
"Smith, S. - Cuneiform Texts from Cappadocian Tablets in the British Museum, CCT 1, 1921.pdf",Cuneiform Texts from Cappadocian Tablets in the British Museum. Part I. (Plates 1-50.),E. A. Wallis Budge,London,,,1921,
"Snell, D. - The Activities of Some Merchants of Umma 08.pdf",The Activities of Some Merchants of Umma,Daniel C. Snell,,Iraq,39,1977,45-50
"Soldt, W.H. van ed. - Veenhof Anniversary Volume. PIHANS 89, 2001.pdf",Veenhof Anniversary Volume - Studies Presented to Klaas R. Veenhof on the Occasion of his Sixty-Fifth Birthday,"W.H. van Soldt, J.G. Dercksen, N.J.C. Kouwenberg, Th.J.H. Krispijn",Leiden,Nederlands Instituut voor het Nabije Oosten,89,2001,1–361
Soysal_2005_ZA95_althethitischen_GeschichteIII.pdf,Beiträge zur althethitischen Geschichte (III),Og˘uz Soysal,Chicago,Zeitschrift für Assyriologie,95,2005,121–144
"Spar, Ira ed. - Tablets, Cones, and Bricks of the Third and Second Millennia B.C., Pt. 1-2. CTMMA 1, 1988.pdf","Cuneiform texts in The Metropolitan Museum of Art, Volume I",Ira Spar,New York,The Metropolitan Museum of Art,1,1988,
Stein 2008 TUBA-AR.pdf,A THEORETICAL MODEL FOR POLITICAL ECONOMY AND SOCIAL IDENTITY IN THE OLD ASSYRIAN COLONIES OF ANATOLIA,Gil J. STEIN,Chicago,TÜBA-AR,XI,2008,
Stein Tüba-Ar 2008.pdf,A THEORETICAL MODEL FOR POLITICAL ECONOMY AND SOCIAL IDENTITY IN THE OLD ASSYRIAN COLONIES OF ANATOLIA,Gil J. STEIN,Chicago,TÜBA-AR,XI,2008,
"Stein, Gil - From Passive Periphery to Active Agents. AmAnthro NS 104 3, 2002 pp. 903-916.pdf",From Passive Periphery to Active Agents: Emerging Perspectives in the Archaeology of Interregional Interaction,GIL J. STEIN,,American Anthropologist,104,2002,903-916
"Stein, Gil - Hetrogeneity.pdf","Heterogeneity, Power, and Political Economy: Some Current Research Issues in the Archaeology of Old World Complex Societies",Gil J. Stein,,Journal of Archaeological Research,6,1998,1–1
"Stein, Gil - The Economic Organization of Northern Mesopotamian Urbanism in the 3 Millennium BC. Archaeological Perspecitives on Political Economies 2004 pp. 61-78.pdf",Structural Parameters and Sociocultural Factors in the Economic Organization of North Mesopotamian Urbanism in the Third Millennium B.C.,Gil Stein,,,,2004,
"Stein, Gil J. - Tell Zeidan Archaeological Report. Summer 08-09 (noPW).pdf",Tell Zeidan: A Unique Opportunity to Investigate Ubaid Society,Gil J. Stein,,,,2008,
"Stein, Gil Jeremy - Pastoral Production in Complex Societies. Diss U Penn 1988 (2).pdf",,Gil J. Stein,,,,1988,
"Stein, Gil Jeremy - Pastoral Production in Complex Societies. Diss U Penn 1988.pdf","Pastoral production in complex societies: Mid-late third millennium B.C. and medieval faunal remains from Gritille Höyük in the Karababa Basin, southeast Turkey",Gil J. Stein,University of Pennsylvania,,,1988,
Stein_1995_CKLR79_romlaw.pdf,,Gil J. Stein,,,Chi.-Kent L. Rev.,1995,1994-1995
"Steiner, G. - Kaufmanns- und handelssprachen im alten orient 04.pdf",Kaufmanns- und handelssprachen im alten orient,Gerd Steiner,,Iraq,39,1977,17-Nov
Steinkeller_04_3rdMpaleo.pdf,"Studies in Third Millennium Paleography, 4: Sign kisˇ",Piotr Steinkeller,Harvard University,,4,2004,175–185
"Stratford, Edward - Agents, Archives, and Risk. A Micronarrative Account of Old Assyrian Trade Through Salim-ahum's Activities in 1890 B.C. Diss Chicago 2010.pdf","AGENTS, ARCHIVES, AND RISK: A MICRONARRATIVE ACCOUNT OF OLD ASSYRIAN TRADE THROUGH ŠAL)- !ͪ5- 3 ACTIVITIES IN 1890 B.C.",EDWARD PAUL STRATFORD,"CHICAGO, ILLINOIS",,,2010,
Stratford_2015_Eponyms.pdf,"Successor Eponyms, Debt Notes, Intercalation, and the Old Assyrian Calendar during Kültepe Level II: A Critical Reappraisal",Edward Stratford,Brigham Young University,Journal of Near Eastern Studies,74,2015,301-324
